billNumber,billType,title,status
65,House Joint Resolution,Request interim study of DUI,Failed
364,House Bill,Generally revise laws related to immunizations,Failed
600,House Bill,Authorize emergency use of albuterol in a school setting,Passed
792,House Bill,Generally revise laws related to cannabis labeling and education,Passed
825,House Bill,Generally revise laws related to health care proxy decisionmakers,Passed
826,House Bill,Generally revise tobacco tax laws,Failed
827,House Bill,Revise social security income taxation,Failed
