billNumber,billType,title,status
201,Senate Bill,Revise contaminated property cleanup laws for dangerous drugs,Passed
426,Senate Bill,Generally revise the Uniform Commercial Code,Passed
446,Senate Bill,Revise laws related to healthcare utilization review,Passed
447,Senate Bill,Revise laws related to prior authorization,Passed
448,Senate Bill,Generally revise laws related to payments made by health carriers,Failed
449,Senate Bill,Generally revise health utilization review laws,Passed
555,Senate Bill,Generally revise gambling laws,Passed
